0,1,idQ,idA
I set up the FPS on internet,How can I register for FPS in Personal Internet Banking,491,66
i'm registering my FPS,How can I register for FPS in Personal Internet Banking,875,66
do i need to register FPS first?,How can I register for FPS in Personal Internet Banking,2650,66
I am following your instructions to register FPS now.,How can I register for FPS in Personal Internet Banking,2064,66
Do i need to register for FPS?,How can I register for FPS in Personal Internet Banking,2882,66
i am wondering which method to use for fast payment registration,How can I register for FPS in Personal Internet Banking,2126,66
how do I register for FPS?,How can I register for FPS in Personal Internet Banking,463,66
I need set up FPS,How can I register for FPS in Personal Internet Banking,2785,66
how can i register for fast payment,How can I register for FPS in Personal Internet Banking,1454,66
"I am trying to register a fps payment, i cannot view how to do it.",How can I register for FPS in Personal Internet Banking,1166,66
Want to online transfer hk$ from hsbc to hang seng,How can I make a transfer to a different Hong Kong bank account in Personal Internet Banking,2815,36
how can i trasnfer money to my alipay hk account via hsbc ebanking?,How can I make a transfer to a different Hong Kong bank account in Personal Internet Banking,2122,36
I am trying to make a transfer by e-banking to another bank account but,How can I make a transfer to a different Hong Kong bank account in Personal Internet Banking,2258,36
how can I transfer dollar into other local banks through online platform,How can I make a transfer to a different Hong Kong bank account in Personal Internet Banking,1417,36
can i transfer usd to other hk banks in ebanking,How can I make a transfer to a different Hong Kong bank account in Personal Internet Banking,999,36
I am doing a local transfer via online banking.,How can I make a transfer to a different Hong Kong bank account in Personal Internet Banking,892,36
want transfering dollar into other hk banks via another bank account,How can I make a transfer to a different Hong Kong bank account in Personal Internet Banking,1278,36
"I need transfer money HK$400,000.00 to Hong Kong Hang Seng Bank in e-banking, how to do it?",How can I make a transfer to a different Hong Kong bank account in Personal Internet Banking,1813,36
I just do an online USD money transfer from my HSBC account to my local Hang Seng bank account,How can I make a transfer to a different Hong Kong bank account in Personal Internet Banking,2732,36
May i enquire about internet banking set up for local transfer to other bank,How can I make a transfer to a different Hong Kong bank account in Personal Internet Banking,402,36
Do online transfer to hk hang seng bank,How can I make a transfer to a different Hong Kong bank account in Personal Internet Banking,2606,36
I am trying to do an online USD transfer to an account in another bank in HK,How can I make a transfer to a different Hong Kong bank account in Personal Internet Banking,159,36
I want to transfer HKD to hang seng bank on online bank service,How can I make a transfer to a different Hong Kong bank account in Personal Internet Banking,749,36
I want to transfer dollar into other hk banks via online bank,How can I make a transfer to a different Hong Kong bank account in Personal Internet Banking,1095,36
Buy usd sell hkd. How to operate in ebank,How can I make a 24 hour foreign currency exchange via Personal Internet Banking,3312,37
I am trying to exchange my USD to HKD online,How can I make a 24 hour foreign currency exchange via Personal Internet Banking,937,37
How can I buy aud online,How can I make a 24 hour foreign currency exchange via Personal Internet Banking,2302,37
I want to ask how to buy us dollars online,How can I make a 24 hour foreign currency exchange via Personal Internet Banking,910,37
Currency exchange service for vietnam vnd,How can I make a 24 hour foreign currency exchange via Personal Internet Banking,856,37
"if I want to exchange HK$ to foreign currency, can I do it on line",How can I make a 24 hour foreign currency exchange via Personal Internet Banking,2970,37
How can I convert my foreign currency to HKD online,How can I make a 24 hour foreign currency exchange via Personal Internet Banking,1292,37
How can i change hkd to gbp on my own internet banking,How can I make a 24 hour foreign currency exchange via Personal Internet Banking,2519,37
exchange eur online,How can I make a 24 hour foreign currency exchange via Personal Internet Banking,2721,37
can i order to exchange hkd to rmb via internet banking,How can I make a 24 hour foreign currency exchange via Personal Internet Banking,2504,37
I want to ask how to buy USD online?,How can I make a 24 hour foreign currency exchange via Personal Internet Banking,3180,37
How do i buy aud via internet banking,How can I make a 24 hour foreign currency exchange via Personal Internet Banking,189,37
I am trying to convert my hkd to pound online using my hk account,How can I make a 24 hour foreign currency exchange via Personal Internet Banking,2357,37
try to exchange hkd into usd,How can I make a 24 hour foreign currency exchange via Personal Internet Banking,3242,37
can I buy foreign currency through online banking,How can I make a 24 hour foreign currency exchange via Personal Internet Banking,2546,37
Last question is that if i can get usd exchange to usd via internet banking,How can I make a 24 hour foreign currency exchange via Personal Internet Banking,432,37
i would like to know if my account allows me to do currency exchange online,How can I make a 24 hour foreign currency exchange via Personal Internet Banking,433,37
I want to buy SGD how to do it online,How can I make a 24 hour foreign currency exchange via Personal Internet Banking,3000,37
How to exchange hkd to usd online? Thanks,How can I make a 24 hour foreign currency exchange via Personal Internet Banking,3278,37
Would like to exchange Thai baht on-line,How can I make a 24 hour foreign currency exchange via Personal Internet Banking,467,37
How to buy gbp online,How can I make a 24 hour foreign currency exchange via Personal Internet Banking,1209,37
may i know how to buy Euro online?,How can I make a 24 hour foreign currency exchange via Personal Internet Banking,1098,37
"I don't have any australia dollar now, and I want to buy some, can I exchange HKD to AUD online ?",How can I make a 24 hour foreign currency exchange via Personal Internet Banking,1348,37
how to buy US dollar in the internet?,How can I make a 24 hour foreign currency exchange via Personal Internet Banking,2238,37
A currency exchange service for krw at hsbc,How can I make a 24 hour foreign currency exchange via Personal Internet Banking,1217,37
Convert usd 2500 to hkd. Can I do online,How can I make a 24 hour foreign currency exchange via Personal Internet Banking,3370,37
Show me how to exchange jpy in ebank,How can I make a 24 hour foreign currency exchange via Personal Internet Banking,969,37
I want to exchange some pound sterling on line.,How can I make a 24 hour foreign currency exchange via Personal Internet Banking,380,37
Can I buy foreign currency online ?,How can I make a 24 hour foreign currency exchange via Personal Internet Banking,648,37
how can I buy canadian dollars online ?,How can I make a 24 hour foreign currency exchange via Personal Internet Banking,887,37
If I wanna buy jpy from my online bank. How to do that?,How can I make a 24 hour foreign currency exchange via Personal Internet Banking,1861,37
How do i buy nzd via internet banking,How can I make a 24 hour foreign currency exchange via Personal Internet Banking,731,37
Exchange rmb to hkd. Where can i do online please,How can I make a 24 hour foreign currency exchange via Personal Internet Banking,1453,37
I tried to use 24 human resource currency exchange online,How can I make a 24 hour foreign currency exchange via Personal Internet Banking,2233,37
can i check with hsbc if i can XXX to exchange some usd? can i do it online?,How can I make a 24 hour foreign currency exchange via Personal Internet Banking,2044,37
Can i use my online banking account to exchange some TWD?,How can I make a 24 hour foreign currency exchange via Personal Internet Banking,305,37
I don't know how to buy gbp with my hkd online,How can I make a 24 hour foreign currency exchange via Personal Internet Banking,3193,37
Buy jpy. how can i do it online,How can I make a 24 hour foreign currency exchange via Personal Internet Banking,2385,37
how to use a favourate rate through ebanking to purchase USD,How can I make a 24 hour foreign currency exchange via Personal Internet Banking,1087,37
How does hkd exchange to usd on my internet banking,How can I make a 24 hour foreign currency exchange via Personal Internet Banking,1598,37
I want to buy some AUD online,How can I make a 24 hour foreign currency exchange via Personal Internet Banking,3125,37
I would like to know if I buy THB from my HK savings account through the internet banking.,How can I make a 24 hour foreign currency exchange via Personal Internet Banking,1126,37
"I would like to exchange HKD to USD on line, how do I do it?",How can I make a 24 hour foreign currency exchange via Personal Internet Banking,890,37
Can I exchange my us dollar for hkd online,How can I make a 24 hour foreign currency exchange via Personal Internet Banking,791,37
know how to buy eur online,How can I make a 24 hour foreign currency exchange via Personal Internet Banking,2667,37
A way to exchange hkd to krw today,How can I make a 24 hour foreign currency exchange via Personal Internet Banking,1391,37
Buy aud online,How can I make a 24 hour foreign currency exchange via Personal Internet Banking,668,37
I'd like to exchange my hkd for usd online,How can I make a 24 hour foreign currency exchange via Personal Internet Banking,1807,37
"I want to make foreign exchange via e banking, but I dont know how to manage, can you teach me",How can I make a 24 hour foreign currency exchange via Personal Internet Banking,2859,37
Exchange gbp 2000 to hk in my account. Can i go for it in online,How can I make a 24 hour foreign currency exchange via Personal Internet Banking,2549,37
Exchange some hkd to aud how to do? I do that online,How can I make a 24 hour foreign currency exchange via Personal Internet Banking,1897,37
I was wondering can I buy Australia Dollar through online banking ?,How can I make a 24 hour foreign currency exchange via Personal Internet Banking,1324,37
Can i try exchanging usd to hkd online,How can I make a 24 hour foreign currency exchange via Personal Internet Banking,1162,37
May I know how to exchange HKD to USD by online banking?,How can I make a 24 hour foreign currency exchange via Personal Internet Banking,3195,37
I want to buy some Euro through on-line banking.,How can I make a 24 hour foreign currency exchange via Personal Internet Banking,2006,37
Get some jpy. Should i exchange it first online,How can I make a 24 hour foreign currency exchange via Personal Internet Banking,428,37
Enquire how to exchange jpy online,How can I make a 24 hour foreign currency exchange via Personal Internet Banking,1293,37
can I do currency exchange online?,How can I make a 24 hour foreign currency exchange via Personal Internet Banking,3224,37
Buy some rmb online but don't know how to do,How can I make a 24 hour foreign currency exchange via Personal Internet Banking,3243,37
Can I exchange Euro online,How can I make a 24 hour foreign currency exchange via Personal Internet Banking,1486,37
buy gbp can perform it online,How can I make a 24 hour foreign currency exchange via Personal Internet Banking,2921,37
How can I buy Canadian dollars online?,How can I make a 24 hour foreign currency exchange via Personal Internet Banking,2564,37
exchange some hkd to cad please advice how to do it in ebank,How can I make a 24 hour foreign currency exchange via Personal Internet Banking,481,37
I would like to exchange my foreign currency through ebanking,How can I make a 24 hour foreign currency exchange via Personal Internet Banking,1346,37
How to buy GBP on line,How can I make a 24 hour foreign currency exchange via Personal Internet Banking,2035,37
How to buy uk pound from online,How can I make a 24 hour foreign currency exchange via Personal Internet Banking,2637,37
I am looking for 24 hours unit currency exchange button,How can I make a 24 hour foreign currency exchange via Personal Internet Banking,378,37
Buy aud online. Am at currency. Where do i continue,How can I make a 24 hour foreign currency exchange via Personal Internet Banking,2428,37
"I want to exchange RMB in my Advance Acct to HKG by using on-line banking, how can I do so?",How can I make a 24 hour foreign currency exchange via Personal Internet Banking,803,37
Can I exchange HK dollars into US dollars on line now?,How can I make a 24 hour foreign currency exchange via Personal Internet Banking,3119,37
may i know how to convert my HKD to USD in the online banking?,How can I make a 24 hour foreign currency exchange via Personal Internet Banking,1589,37
I like to exchange hkd to usd by online today,How can I make a 24 hour foreign currency exchange via Personal Internet Banking,3121,37
Can i exchange hkd to gbp on internet banking,How can I make a 24 hour foreign currency exchange via Personal Internet Banking,745,37
"good evening ,  i would like to ask , how can i exchange USD or HKD into  RMB online ?",How can I make a 24 hour foreign currency exchange via Personal Internet Banking,41,37
I want to convert HKD to USD how can I do this online from online banking?,How can I make a 24 hour foreign currency exchange via Personal Internet Banking,2912,37
Find how to convert my cad to hkd using internet banking,How can I make a 24 hour foreign currency exchange via Personal Internet Banking,2124,37
I want to buy some usdollar on line,How can I make a 24 hour foreign currency exchange via Personal Internet Banking,3330,37
i would like to exchange HKD to USD via online banking,How can I make a 24 hour foreign currency exchange via Personal Internet Banking,3235,37
how can i transfer some HKD into USD online?,How can I make a 24 hour foreign currency exchange via Personal Internet Banking,3368,37
I want to use HKD to buy AUD online.,How can I make a 24 hour foreign currency exchange via Personal Internet Banking,1384,37
I tried to use the Global Transfer but got an error.,How can I check the reason why my Global Transfer is not successfully processed,3277,5
transfer usd to my XXX in turkey but I cannot do it from global transfer,How can I check the reason why my Global Transfer is not successfully processed,133,5
Why I can't transfer from premier hk to premier uk by using global transfer,How can I check the reason why my Global Transfer is not successfully processed,2278,5
i cannot make the global transfer,How can I check the reason why my Global Transfer is not successfully processed,1245,5
Why I cannot proceed with global transfer from my hk account to china account,How can I check the reason why my Global Transfer is not successfully processed,2928,5
can't use global transfer,How can I check the reason why my Global Transfer is not successfully processed,1307,5
"I am trying to do global online transfer, from my hkd account in canada to hkd in hk. Online message said  my demand cannot process with account choice",How can I check the reason why my Global Transfer is not successfully processed,652,5
transfer hk to singapore account on ? through global transfer. But system will not ? me,How can I check the reason why my Global Transfer is not successfully processed,318,5
Right now global transfer shows that I don't have american account to carry out transfer,How can I check the reason why my Global Transfer is not successfully processed,237,5
made global transfer of gbp from hk account to uk account sole didn't come off,How can I check the reason why my Global Transfer is not successfully processed,1070,5
"But not successful when I try global transfer an hour ago,",How can I check the reason why my Global Transfer is not successfully processed,361,5
please advise why I cannot simply global transfer in hk website,How can I check the reason why my Global Transfer is not successfully processed,2728,5
"I can see my account in china on the account dashboard, but I cannot do any global transfer",How can I check the reason why my Global Transfer is not successfully processed,2870,5
Unable to engage global transfer to move $ from HK account to US one like before.,How can I check the reason why my Global Transfer is not successfully processed,1338,5
but my global transfer function online says my account is not enabled for this,How can I check the reason why my Global Transfer is not successfully processed,1174,5
But we cannot make global transfer to my oversea account.,How can I check the reason why my Global Transfer is not successfully processed,1252,5
"I am unable to do global transfer, hk to my hsbc france",How can I check the reason why my Global Transfer is not successfully processed,3084,5
I have a problem making a transfer in GBP to my UK account from my HSBC Premier GBP account,How can I check the reason why my Global Transfer is not successfully processed,3035,5
Last night I cannot do global transfer from my hk premier account,How can I check the reason why my Global Transfer is not successfully processed,3284,5
I try to do the global transfer from HK to UK but not successful.,How can I check the reason why my Global Transfer is not successfully processed,3364,5
I want to global transfer from my hk account to my Canada account and I can't do it.,How can I check the reason why my Global Transfer is not successfully processed,3199,5
But I don't have account available to carry out payment via global transfer,How can I check the reason why my Global Transfer is not successfully processed,2321,5
"For some reason, when I go to ""Global Transfer"" it's not allowing me to proceed.",How can I check the reason why my Global Transfer is not successfully processed,1438,5
But I can't make payment through global transfer,How can I check the reason why my Global Transfer is not successfully processed,2201,5
I cannot continue my transfer usd to my XXX in taiwan,How can I check the reason why my Global Transfer is not successfully processed,1064,5
I just got a mobile security code but somehow I cannot do global transfer now.,How can I check the reason why my Global Transfer is not successfully processed,649,5
But global transfer is not working,How can I check the reason why my Global Transfer is not successfully processed,3052,5
I am unable to do a global transfer from my premier hk account to premier us account,How can I check the reason why my Global Transfer is not successfully processed,2681,5
When I try to use global transfer service. It's not working,How can I check the reason why my Global Transfer is not successfully processed,1958,5
Why I cannot do global transfer now,How can I check the reason why my Global Transfer is not successfully processed,1781,5
why I cannot transfer money by global transfer hk to my account in uk?,How can I check the reason why my Global Transfer is not successfully processed,1136,5
I am not able to make global transfer now,How can I check the reason why my Global Transfer is not successfully processed,853,5
would like to transer money via global transfer but was denied,How can I check the reason why my Global Transfer is not successfully processed,1662,5
tried to use global transfer but failed,How can I check the reason why my Global Transfer is not successfully processed,382,5
why my global transfer is not,How can I check the reason why my Global Transfer is not successfully processed,208,5
I just tried to do a global transfer without success i want to know why,How can I check the reason why my Global Transfer is not successfully processed,2752,5
I am doing a global transfer but why it is restricted,How can I check the reason why my Global Transfer is not successfully processed,3247,5
But when I tried it said none of my accounts are avaialbale fro global transfer...,How can I check the reason why my Global Transfer is not successfully processed,697,5
Why I can't transfer thb to thb to through global transfer,How can I check the reason why my Global Transfer is not successfully processed,2393,5
"When I  go to global transfer, it says don't have account available",How can I check the reason why my Global Transfer is not successfully processed,3286,5
I went to Global Transfer and it said I do not have an account available to carry out this payment.,How can I check the reason why my Global Transfer is not successfully processed,1930,5
I am unable to make a global transfer,How can I check the reason why my Global Transfer is not successfully processed,2575,5
Why I cant use Global transfer AUD money to my daughter,How can I check the reason why my Global Transfer is not successfully processed,3124,5
I already logged on both HK and Canada internet banking but unable to do global transfer.,How can I check the reason why my Global Transfer is not successfully processed,1726,5
i am having trouble making a Global trf from HK ac to my UK ac.,How can I check the reason why my Global Transfer is not successfully processed,1333,5
Now I cannot use global transfer,How can I check the reason why my Global Transfer is not successfully processed,1371,5
I am not able to make a global transfer,How can I check the reason why my Global Transfer is not successfully processed,2371,5
I went onto Global transfers and it says you do not have an account to carry out,How can I check the reason why my Global Transfer is not successfully processed,2658,5
"i want to transfer $180,000 from 503-644* by global transfer to my HKD A/C in Canada but rejected",How can I check the reason why my Global Transfer is not successfully processed,1472,5
How come I cannot do my global  transfer as I did before?,How can I check the reason why my Global Transfer is not successfully processed,2705,5
Why I cannot do a global transfer from my canada account to hk cad account,How can I check the reason why my Global Transfer is not successfully processed,2045,5
But why I have problem when clicking global transfer,How can I check the reason why my Global Transfer is not successfully processed,858,5
"I tried to transfer money from HK HSBC to my Canada HSBC account, but failed.",How can I check the reason why my Global Transfer is not successfully processed,1182,5
I am trying to carry on a global transfer but didn't success,How can I check the reason why my Global Transfer is not successfully processed,2657,5
I am unable to do a global transfer of singapore dollars in my HK account to my Singapore account.,How can I check the reason why my Global Transfer is not successfully processed,1279,5
i tried to do a global transfer but failed,How can I check the reason why my Global Transfer is not successfully processed,2563,5
"I have been using the global transfer, but I couldn't make it this time.",How can I check the reason why my Global Transfer is not successfully processed,217,5
its says that my account is not available to carry out global transfer,How can I check the reason why my Global Transfer is not successfully processed,1957,5
"when I try using global transfer service, it doesn't work",How can I check the reason why my Global Transfer is not successfully processed,1559,5
i want to ask why i can't global transfer from HKD to my IDR savings account in Indonesia ?,How can I check the reason why my Global Transfer is not successfully processed,1406,5
I am trying to do a global transfer between accounts. I receive error message,How can I check the reason why my Global Transfer is not successfully processed,266,5
"Try to global transfer, hk to canada but get error message below",How can I check the reason why my Global Transfer is not successfully processed,2942,5
I cannot do global transfer from my hk account,How can I check the reason why my Global Transfer is not successfully processed,2397,5
I have problem to arrange global transfer,How can I check the reason why my Global Transfer is not successfully processed,2422,5
Do global transfer but failed finishing,How can I check the reason why my Global Transfer is not successfully processed,1612,5
"then I added my Aust acc in Globalview, but the Global Transfer option still not available",How can I check the reason why my Global Transfer is not successfully processed,1713,5
"But when I go to ""Global Transfer"", it says I do not have an account available to transfer money.",How can I check the reason why my Global Transfer is not successfully processed,1959,5
I am having trouble with making a global transfer from my hk account to my us account,How can I check the reason why my Global Transfer is not successfully processed,1730,5
"I have problems in global transfer. When I press continue button, there is no response",How can I check the reason why my Global Transfer is not successfully processed,476,5
Use global transfer to transfer hk to  canada but it's not working,How can I check the reason why my Global Transfer is not successfully processed,3091,5
I am trying to transfer cad from hk account to canada account via global transfer but failed with error,How can I check the reason why my Global Transfer is not successfully processed,2034,5
I still cannot do a global transfer.,How can I check the reason why my Global Transfer is not successfully processed,3298,5
but still i can't do global transfer,How can I check the reason why my Global Transfer is not successfully processed,383,5
