0,1,idQ,idA
"i mean i transfer sterling pound at the counter, locally , to a local citibank account .",How do I make a transfer to a different Hong Kong bank account,1379,57
"If I would like to transfer usd to a local account, what will be the best option",How do I make a transfer to a different Hong Kong bank account,3290,57
transfer usd to inter-bank in hk,How do I make a transfer to a different Hong Kong bank account,2074,57
I'm trying to make local transfer to a Bank of China (Hong Kong) bank account.,How do I make a transfer to a different Hong Kong bank account,2218,57
How about e transfer in USD to a local bank in HK?,How do I make a transfer to a different Hong Kong bank account,2671,57
It's a transfer to an account in a local bank,How do I make a transfer to a different Hong Kong bank account,3329,57
I want to do a transfer of HKD 200000 to another payee in a local bank tomorrow.,How do I make a transfer to a different Hong Kong bank account,2588,57
I would like to transfer a sum to a non registered local bank,How do I make a transfer to a different Hong Kong bank account,708,57
I want to transfer USD to other local bank.,How do I make a transfer to a different Hong Kong bank account,1741,57
I am doing online local transfer to a non hsbc bank account,How do I make a transfer to a different Hong Kong bank account,1008,57
I'm trying to set up a local transfer to Bank of East Asia (BEA),How do I make a transfer to a different Hong Kong bank account,3007,57
i want to made a transfer to citibank hk,How do I make a transfer to a different Hong Kong bank account,143,57
there i need to make a transfer to a local Citibank account.,How do I make a transfer to a different Hong Kong bank account,2338,57
I am trying to transfer USD from my HSBC account to BOC HK account,How do I make a transfer to a different Hong Kong bank account,1390,57
I'd like to transfer from my XXX to my own citi bank hk account,How do I make a transfer to a different Hong Kong bank account,1016,57
how to transfer USD to other local bank?,How do I make a transfer to a different Hong Kong bank account,1025,57
I want to transfer money from my USD savings to another USD savings account at other local bank,How do I make a transfer to a different Hong Kong bank account,1552,57
transfer within hk from hsbc account to citi bank account,How do I make a transfer to a different Hong Kong bank account,280,57
Local bank transfer is from my HSBC to non-HSBC local bank.,How do I make a transfer to a different Hong Kong bank account,1343,57
make a transfer to inter-bank in hk under my name in usd,How do I make a transfer to a different Hong Kong bank account,1544,57
How to move money to another bank in Hong Kong under my name?,How do I make a transfer to a different Hong Kong bank account,83,57
I a trying to make a payment to a boc hk bank account,How do I make a transfer to a different Hong Kong bank account,1497,57
local HSBC transfer to local Citibank,How do I make a transfer to a different Hong Kong bank account,1956,57
I want to make a transfer from my Premier USD account to my broker at Citibank HK.,How do I make a transfer to a different Hong Kong bank account,1400,57
transfer rmb to account with dbs  hk under my own name,How do I make a transfer to a different Hong Kong bank account,1120,57
can I transfer usd currency from my usd saving account to payee with local  usd account,How do I make a transfer to a different Hong Kong bank account,1242,57
i am trying to transfer hkd from hsbc to my citibank hongkong a/c but unable to transfer,How do I make a transfer to a different Hong Kong bank account,943,57
"quick question, I am trying to make a transfer to my son's citi bank hk bank account",How do I make a transfer to a different Hong Kong bank account,130,57
make local transfer while I am not in hk,How do I make a transfer to a different Hong Kong bank account,2589,57
but when i tried to transfer money to another local bank,How do I make a transfer to a different Hong Kong bank account,1474,57
"I want to do a local transfer, but USD.",How do I make a transfer to a different Hong Kong bank account,171,57
I want to transfer money from my HSBC account (HKD) to another local bank (HKD),How do I make a transfer to a different Hong Kong bank account,3357,57
i am trying to do a local transfer to Hang Seng bank,How do I make a transfer to a different Hong Kong bank account,655,57
How to do? I transfer usd to inter-bank in hk under my name,How do I make a transfer to a different Hong Kong bank account,3093,57
Try to do a local transfer to China bank,How do I make a transfer to a different Hong Kong bank account,782,57
How do I transfer hkd to local another account? it is china construction bank in hk,How do I make a transfer to a different Hong Kong bank account,3164,57
"Please advise how I can transfer money to a local bank via internet banking, please?",How do I make a transfer to a different Hong Kong bank account,487,57
i wanna transfer amount to dbs hk,How do I make a transfer to a different Hong Kong bank account,2581,57
i want to move money to another local account in Hong Kong,How do I make a transfer to a different Hong Kong bank account,3135,57
"I intend to transfer usd to other local bank, china construction bank, for instance",How do I make a transfer to a different Hong Kong bank account,2059,57
actually transfer to another local bank in hong kong for US$ and GBP.,How do I make a transfer to a different Hong Kong bank account,3047,57
I am trying to make a payment to another local hk bank,How do I make a transfer to a different Hong Kong bank account,2262,57
I intend to transfer USD from HSBC to Another local bank also into a USD account.,How do I make a transfer to a different Hong Kong bank account,2054,57
I am trying to transfer to 3rd party to other local bank account,How do I make a transfer to a different Hong Kong bank account,1079,57
I will try to transfer fund to hk other bank,How do I make a transfer to a different Hong Kong bank account,1751,57
"I am trying to do a local transfer to a HK bank.for USD47,322.",How do I make a transfer to a different Hong Kong bank account,365,57
transfer to a boc hk account which have a digit account number,How do I make a transfer to a different Hong Kong bank account,294,57
make a transfer of aud from my aud account to other local bank,How do I make a transfer to a different Hong Kong bank account,684,57
how can I transfer money to DBS in Hong Kong?,How do I make a transfer to a different Hong Kong bank account,1386,57
"I am using online service, wanna do a local transfer to hang seng bank",How do I make a transfer to a different Hong Kong bank account,2310,57
I am trying to transfer some of my fund  in hkd to my account in boc hk,How do I make a transfer to a different Hong Kong bank account,1052,57
"also, the transfer is to make to bank of china hong kong",How do I make a transfer to a different Hong Kong bank account,2544,57
i would like to transfer USD from my HSBC account to another local bank,How do I make a transfer to a different Hong Kong bank account,336,57
how about if transferring money to other local banks like standard chartered bank?,How do I make a transfer to a different Hong Kong bank account,1336,57
i want to make a USD transfer to a local account,How do I make a transfer to a different Hong Kong bank account,1742,57
i m trying to do a local transfer to a Bank of China account.,How do I make a transfer to a different Hong Kong bank account,2052,57
i'm trying to transfer 400k to another local bank account,How do I make a transfer to a different Hong Kong bank account,3325,57
How do I transfer money to another local bank please?,How do I make a transfer to a different Hong Kong bank account,976,57
I would like to transfer USD from my HSBC premier account to another HK local bank i.e.,How do I make a transfer to a different Hong Kong bank account,927,57
Transfer to other ppl in other local bank account,How do I make a transfer to a different Hong Kong bank account,400,57
How can I use my hkd currency account transfer to other local bank,How do I make a transfer to a different Hong Kong bank account,1864,57
wanna do the local transfer to citibank,How do I make a transfer to a different Hong Kong bank account,234,57
I want to transfer some USD to another local bank,How do I make a transfer to a different Hong Kong bank account,2528,57
I would like to transfer ******** USD from hong kong HSBC account to local other bank account.,How do I make a transfer to a different Hong Kong bank account,2023,57
Am trying to transfer to other local bank,How do I make a transfer to a different Hong Kong bank account,3034,57
I am trying to make a transfer to a business in Hong Kong,How do I make a transfer to a different Hong Kong bank account,1765,57
transfer from my XXX to local bank of china,How do I make a transfer to a different Hong Kong bank account,2295,57
essential I need to make a wire transfer to another local bank in HK in USD.,How do I make a transfer to a different Hong Kong bank account,2788,57
I have been trying to make a transfer to a standard chartered bank in HK.,How do I make a transfer to a different Hong Kong bank account,3185,57
i am trying to do a local bank transfer to bank of china,How do I make a transfer to a different Hong Kong bank account,861,57
I was trying to transfer money to a local bank account,How do I make a transfer to a different Hong Kong bank account,3394,57
I want to transfer 20 thousands HKD to First Commercial Bank in Hong Kong.,How do I make a transfer to a different Hong Kong bank account,1528,57
how do i make fund transfer from hsbc account to my own account in DBS bank HK?,How do I make a transfer to a different Hong Kong bank account,3089,57
Please advise how to transfer money to Hang Seng Bank in HK,How do I make a transfer to a different Hong Kong bank account,2566,57
I am trying to do online transfer to another local hk bank,How do I make a transfer to a different Hong Kong bank account,3162,57
I am trying to transfer money to a Bank of China (HK) account.,How do I make a transfer to a different Hong Kong bank account,3008,57
I am wanting to transfer an amount of money to another bank in HK.,How do I make a transfer to a different Hong Kong bank account,1359,57
How can I transfer USD to another USD account in a local bank in HK?,How do I make a transfer to a different Hong Kong bank account,1698,57
I was trying to transfer to other local bank account,How do I make a transfer to a different Hong Kong bank account,3186,57
how to transfer my money HSBC account to another payee's local Hang Seng bank?,How do I make a transfer to a different Hong Kong bank account,1449,57
I am trying to make a transfer to account at wing lung bank in hk,How do I make a transfer to a different Hong Kong bank account,2284,57
transfer to another local bank account,How do I make a transfer to a different Hong Kong bank account,1850,57
I want to transfer USD to another local HK bank,How do I make a transfer to a different Hong Kong bank account,2965,57
try to make a local bank transfer,How do I make a transfer to a different Hong Kong bank account,1367,57
I would like to transfer ******** USD from my hong kong HSBC account to other local bank account.,How do I make a transfer to a different Hong Kong bank account,1661,57
transfer some money from my XXX to my account with other local bank,How do I make a transfer to a different Hong Kong bank account,2834,57
"i want to transfer money to hk citibank with this name ""interactive brokers hong kong limited""",How do I make a transfer to a different Hong Kong bank account,1248,57
I am trying to send money to other local bank but payees,How do I make a transfer to a different Hong Kong bank account,1914,57
Try to do a online transfer to another local hk bank,How do I make a transfer to a different Hong Kong bank account,914,57
How to transfer to a china bank account hk,How do I make a transfer to a different Hong Kong bank account,3279,57
I want to transfer USD from my HSBC account to state Bank of India in Hong Kong.,How do I make a transfer to a different Hong Kong bank account,635,57
need to do a transfer to dbs hong kong urgently.,How do I make a transfer to a different Hong Kong bank account,182,57
I am trying to make a USD transfer from my HSBC account to HDFC Bank in Hong Kong.,How do I make a transfer to a different Hong Kong bank account,1672,57
how can i transfer H********000 to my own account in Bank of China HK?,How do I make a transfer to a different Hong Kong bank account,81,57
"can I transfer USD 300,000 to my bank account in Bank of China HK ?",How do I make a transfer to a different Hong Kong bank account,454,57
I would like to make a local transfer,How do I make a transfer to a different Hong Kong bank account,261,57
I want to make a one off transfer from my account to a Hang Seng Bank account number in Hong Kong ?,How do I make a transfer to a different Hong Kong bank account,2120,57
I am trying to transfer from my HSBC HK account to my Citibank HK account.,How do I make a transfer to a different Hong Kong bank account,493,57
I am transferring $ to another local bank,How do I make a transfer to a different Hong Kong bank account,20,57
If i wanna set a request move money to other local bank like citi bank,How do I make a transfer to a different Hong Kong bank account,2183,57
what about if i transfer from HSBC to Hang Seng local bank ?,How do I make a transfer to a different Hong Kong bank account,1775,57
I would like to send USD to another Hong Kong bank under my name.,How do I make a transfer to a different Hong Kong bank account,2464,57
Can I transfer USD to local bank in Hong Kong?,How do I make a transfer to a different Hong Kong bank account,96,57
I wanted to use FPS to transfer money to DBS HK account,How do I make a transfer to a different Hong Kong bank account,664,57
"im trying to transfer 6700 usd, to an account in HK at DBS",How do I make a transfer to a different Hong Kong bank account,30,57
I would like to transfer USD to my local bank account in Hang Seng,How do I make a transfer to a different Hong Kong bank account,35,57
I would like to transfer money to Standard Chartered Hong Kong.,How do I make a transfer to a different Hong Kong bank account,2170,57
i am trying to transfer hkd to a local DBS account,How do I make a transfer to a different Hong Kong bank account,3188,57
"CAN I TRANSFER 600,000 TO MY OTHER ACCOUNT IN A LOCAL BANK",How do I make a transfer to a different Hong Kong bank account,2348,57
Is it possible to transfer money to another local HK bank today?,How do I make a transfer to a different Hong Kong bank account,98,57
How to do? I transfer to a 3rd party hang sang account in hk,How do I make a transfer to a different Hong Kong bank account,3017,57
Last night I wanna transfer to other local bank account,How do I make a transfer to a different Hong Kong bank account,3333,57
transfer usd from my hk account to an inter-bank local account,How do I make a transfer to a different Hong Kong bank account,2077,57
how can i transfer aud from my XXX to my other account of local bank,How do I make a transfer to a different Hong Kong bank account,3282,57
I need make a transfer 200.00 USD to DBS bank HK,How do I make a transfer to a different Hong Kong bank account,1351,57
i wonder how to make a transfer to another local bank?,How do I make a transfer to a different Hong Kong bank account,3151,57
Cuz you're teaching me how to transfer USD to another local bank USD ac,How do I make a transfer to a different Hong Kong bank account,674,57
i would like to transfer money to another local bank - Bank of East Asia (Hong Kong),How do I make a transfer to a different Hong Kong bank account,1636,57
i am trying to do a local transfer.,How do I make a transfer to a different Hong Kong bank account,636,57
"i want to transfer to citibank N.A., Hong Kong Branch.",How do I make a transfer to a different Hong Kong bank account,456,57
I would like to transfer money to another bank in Hong Kong,How do I make a transfer to a different Hong Kong bank account,878,57
i have to make a local transfer to BOC,How do I make a transfer to a different Hong Kong bank account,609,57
i want to local transfer money to my other bank account (hang seng),How do I make a transfer to a different Hong Kong bank account,1986,57
I am transferring to another HK 3rd party bank account,How do I make a transfer to a different Hong Kong bank account,1841,57
transfer to other local bank monthly,How do I make a transfer to a different Hong Kong bank account,864,57
I wanted to make local transfer to other HK bank,How do I make a transfer to a different Hong Kong bank account,2475,57
I want to transfer the fund to a local other bank account,How do I make a transfer to a different Hong Kong bank account,388,57
I would like to transfer money to another bank in Hong Kong .,How do I make a transfer to a different Hong Kong bank account,2821,57
I would like to transfer from my USD account to another local bank in HK,How do I make a transfer to a different Hong Kong bank account,1761,57
I am trying to make a transfer to another local bank account.,How do I make a transfer to a different Hong Kong bank account,474,57
i want to transfer HKD 50000 to other local bank.,How do I make a transfer to a different Hong Kong bank account,1215,57
I tried to make a HKD fund transfer to another local bank.,How do I make a transfer to a different Hong Kong bank account,3296,57
Transfer a small amount of usd to other local bank,How do I make a transfer to a different Hong Kong bank account,813,57
would like to transfer USD from my HSBC account to Citi Hong Kong USD account,How do I make a transfer to a different Hong Kong bank account,320,57
i want to do a local bank transfer,How do I make a transfer to a different Hong Kong bank account,2740,57
I tried to make a transfer to another local bank account of mine,How do I make a transfer to a different Hong Kong bank account,2164,57
For transfer of funds to my own personal account at another bank in hk,How do I make a transfer to a different Hong Kong bank account,3100,57
i want to transfer US$ to another local bank and got error msg V********001?,How do I make a transfer to a different Hong Kong bank account,2782,57
i am going to do a transfer of US$ to CitiBank Hong KOng.,How do I make a transfer to a different Hong Kong bank account,576,57
i want to transfer money to my account in other local bank.,How do I make a transfer to a different Hong Kong bank account,469,57
How to set up transfer of money from my HSBC account to other Hong Kong bank?,How do I make a transfer to a different Hong Kong bank account,441,57
How can I transfer USD to other local bank?,How do I make a transfer to a different Hong Kong bank account,243,57
i want to ask if transfer of USD from HSBC to Citibank HK,How do I make a transfer to a different Hong Kong bank account,641,57
I want to transfer money to dbs Hong Kong but failed,How do I make a transfer to a different Hong Kong bank account,557,57
I want to make a transfer online to DBS hk,How do I make a transfer to a different Hong Kong bank account,3299,57
I am trying ot make a global transfer in Canadian dollars to my HSBC account in Canada.,How do I make a Global Transfer to one of my overseas HSBC accounts,1600,31
i want to make a global transfer from my HK HKD saving account to my CN HKD account,How do I make a Global Transfer to one of my overseas HSBC accounts,1610,31
and i was trying to transfer from HKD from my HKD account in HSBC HK to my HKD account in HSBC UK,How do I make a Global Transfer to one of my overseas HSBC accounts,103,31
I am trying to transfer from my gbp account in hsbc hk to my gbp account in hsbc uk in first direct brand,How do I make a Global Transfer to one of my overseas HSBC accounts,2403,31
HOW CAN I TRANSFER HK$  FROM MY HSBC HK ACCOUNT to my HSBC UK account,How do I make a Global Transfer to one of my overseas HSBC accounts,2590,31
make a transfer form my hk hsbc to my singapore hsbc account,How do I make a Global Transfer to one of my overseas HSBC accounts,2243,31
I want to transfer some HKD from my HSBC account in HKG to my HSBC account in USA,How do I make a Global Transfer to one of my overseas HSBC accounts,1816,31
how to transfer saving account to my australia hsbc account in aud,How do I make a Global Transfer to one of my overseas HSBC accounts,2007,31
"I wish to transfer my NZ dollars to my NZ hsbc ACCOUNT, HOW TO DO IT?",How do I make a Global Transfer to one of my overseas HSBC accounts,807,31
how can i transfer to my hsbc uk account,How do I make a Global Transfer to one of my overseas HSBC accounts,1135,31
How I can transfer to my hsbc uk account,How do I make a Global Transfer to one of my overseas HSBC accounts,1055,31
I wanted to trasnfer USD from HK HSBC USD account to my UK HSBC USD account,How do I make a Global Transfer to one of my overseas HSBC accounts,1253,31
how can i transfer from my hk hsbc account to to my us hsbc account,How do I make a Global Transfer to one of my overseas HSBC accounts,796,31
I want to transfer from my HK HSBC account to another HSBC account in Canada,How do I make a Global Transfer to one of my overseas HSBC accounts,44,31
"i have left hk, wish to transfer my hkd savings to my uk hsbc account",How do I make a Global Transfer to one of my overseas HSBC accounts,2287,31
i want to transfer money to my global HSBC account,How do I make a Global Transfer to one of my overseas HSBC accounts,2934,31
how can i transfer money to my HSBC UK account ?,How do I make a Global Transfer to one of my overseas HSBC accounts,1305,31
I am trying to do global transfer from my hk usd account to my us account,How do I make a Global Transfer to one of my overseas HSBC accounts,2253,31
Transfer my savings  to my uk hsbc advance,How do I make a Global Transfer to one of my overseas HSBC accounts,1789,31
i want to transfer from my HSBC-HK USD savings to my HSBC-US USD savings.,How do I make a Global Transfer to one of my overseas HSBC accounts,2046,31
Tried to transfer from my hsbc hkd to my indonesia hsbc usd account,How do I make a Global Transfer to one of my overseas HSBC accounts,2760,31
I want to use Global Link to transfer USD to my Premier account in HSBC(UK).,How do I make a Global Transfer to one of my overseas HSBC accounts,2947,31
I am trying to do a global transfer from my hk to my us account,How do I make a Global Transfer to one of my overseas HSBC accounts,1935,31
I wante o transfer on-line US$200K to my own USD account in the UK HSBC.,How do I make a Global Transfer to one of my overseas HSBC accounts,1617,31
forget how to transfer eur from my hk eur savings to my france hsbc account,How do I make a Global Transfer to one of my overseas HSBC accounts,2457,31
I was trying to make a global transfer to my HSBC USA checking account,How do I make a Global Transfer to one of my overseas HSBC accounts,2042,31
I wish to transfer money from my HSBC HK account to my HSBC Aust account.,How do I make a Global Transfer to one of my overseas HSBC accounts,2431,31
use transfer for moving money to my hsbc australia account,How do I make a Global Transfer to one of my overseas HSBC accounts,2173,31
I would like to do a global transfer of USD from my HK USD savings to my HSBC USA account.,How do I make a Global Transfer to one of my overseas HSBC accounts,2448,31
i want to transfer money to my own name account hsbc australia,How do I make a Global Transfer to one of my overseas HSBC accounts,1763,31
I am trying to amend a recurring global transfer of GBP from Hsbc hk account to my hsbc uk account,How do I make a Global Transfer to one of my overseas HSBC accounts,3208,31
I am transfering from my hsbc hk current account to my hsbc u.s current account,How do I make a Global Transfer to one of my overseas HSBC accounts,3051,31
"i am in my hsbc hk account now, i wanna transfer some money to my hsbc singapore account",How do I make a Global Transfer to one of my overseas HSBC accounts,1139,31
i want to transfer funds from my HK HSBC account to my AU HSBC account.,How do I make a Global Transfer to one of my overseas HSBC accounts,3014,31
I'm trying to make a Global transfer to my account to the UK,How do I make a Global Transfer to one of my overseas HSBC accounts,340,31
i would like to use the Global transfer to transfer funds to my HSBC account in Singapore,How do I make a Global Transfer to one of my overseas HSBC accounts,213,31
I am trying to transfer euro from my HK HSBC euro account to my UK HSBC euro account.,How do I make a Global Transfer to one of my overseas HSBC accounts,2307,31
I intend to transfer USD from my HSBC HK a/c to my HSBC USD canada a/c.,How do I make a Global Transfer to one of my overseas HSBC accounts,2149,31
I want global transfer to my HSBC Canada account,How do I make a Global Transfer to one of my overseas HSBC accounts,3038,31
how to transfer hkd to my hsbc singapore account via global transfer,How do I make a Global Transfer to one of my overseas HSBC accounts,2953,31
how do i make a transfer to my HSBC taiwan premier account?,How do I make a Global Transfer to one of my overseas HSBC accounts,1922,31
i try to Transfer my hk hsbc to uk my hsbc a/c but cannot,How do I make a Global Transfer to one of my overseas HSBC accounts,2569,31
I am trying to transfer hkd to my uk hsbc account,How do I make a Global Transfer to one of my overseas HSBC accounts,3030,31
trying to transfer from my USD savings in HK to my checking account in the US through global transfer,How do I make a Global Transfer to one of my overseas HSBC accounts,874,31
