0,1,idQ,idA
I want hsbc help to guide me how to redeem my credit card reward point,Usage of RewardCash,1451,46
I see the points but want to make sure how to redeem what options are,Usage of RewardCash,1419,46
redeem my points on my credit card for rewardcash,Usage of RewardCash,447,46
i cannot find where to redeem my rewardcash,Usage of RewardCash,1350,46
help sail hsbc site to where i can redeem points,Usage of RewardCash,2355,46
I am wondering if I am able to redeem my reward cash here,Usage of RewardCash,3175,46
how to access to redeem rewardcash,Usage of RewardCash,973,46
can i do reward points redemption on internet banking,Usage of RewardCash,2369,46
I have hkd 3000 reward cash what can I redeem?,Usage of RewardCash,526,46
how to claim reward point from my master card,Usage of RewardCash,519,46
redeem my rewardcash but i don't want to use reward+ app,Usage of RewardCash,2711,46
please explain how to redeem my hsbc rewards point,Usage of RewardCash,792,46
how do i redeem rewards,Usage of RewardCash,732,46
how to redeem points of credit credit,Usage of RewardCash,1631,46
please advice how to redeem in my credit card,Usage of RewardCash,3166,46
please help me for redeeming 123 points,Usage of RewardCash,331,46
ask whether only way to redeem credit card rewards is using reward+ app,Usage of RewardCash,1682,46
"i have some points in mycredit card which are expire,how can i redeem",Usage of RewardCash,2587,46
can i redeem rewardcash without downloading reward+ app,Usage of RewardCash,1609,46
can I redeem point for cash credit to my account?,Usage of RewardCash,2617,46
where can i redeem my reward points online,Usage of RewardCash,205,46
how top use my credit card reward cash dollar,Usage of RewardCash,3024,46
I can find how to use my reward cash,Usage of RewardCash,1522,46
how do i redeem my rewardcash that is expired at the end of next month,Usage of RewardCash,2300,46
I want to redeem reward cash card,Usage of RewardCash,2703,46
"ok, how do I redeem reward cash?",Usage of RewardCash,3064,46
when can I redeem my point,Usage of RewardCash,1441,46
use my credit card to reward points but i don't wanna use hsbc app,Usage of RewardCash,471,46
how do i use my reward points via internet banking,Usage of RewardCash,2551,46
how to redeem reward cash balance,Usage of RewardCash,56,46
can u send me link to redeem reward,Usage of RewardCash,1021,46
how do I reward redemption online,Usage of RewardCash,1913,46
how to redeem my reward point?,Usage of RewardCash,2375,46
how i can redeem my reward,Usage of RewardCash,2316,46
how to redeem my reward points please,Usage of RewardCash,2155,46
i want to redeem my hsbc points but unable to find rewardcash link online,Usage of RewardCash,869,46
know how to use claim rewardcash for credit card online,Usage of RewardCash,1823,46
how to redeem rewardcash of my card,Usage of RewardCash,606,46
please show me path on hsbc website how to redeem rewardcash,Usage of RewardCash,3352,46
how to redeem my reward point online?,Usage of RewardCash,362,46
I know how I can redeem my rewardcash,Usage of RewardCash,2089,46
redeem my hot reward,Usage of RewardCash,781,46
how can i redeem points,Usage of RewardCash,799,46
where to redeem rewardcash,Usage of RewardCash,1362,46
how to redeem credit card reward,Usage of RewardCash,1170,46
credit card rewardcash how to use,Usage of RewardCash,3182,46
how do i redeem my credit card reward points online,Usage of RewardCash,1674,46
how to redeem my reward cash?,Usage of RewardCash,3011,46
how can I redeem reward cash online,Usage of RewardCash,119,46
I have point on my credit card I am trying to trade for reward cash online,Usage of RewardCash,312,46
how do i redeem my rewardcash earned,Usage of RewardCash,1523,46
how to input rewardcash to deduct,Usage of RewardCash,1996,46
I want help to try to solve how to redeem reward cash,Usage of RewardCash,906,46
how to redeem my points of my credit as will expire,Usage of RewardCash,3367,46
know about rewardcash. how can i redeem it if i don't have reward+ app,Usage of RewardCash,886,46
How to redeem my bonus point online ?,Usage of RewardCash,1082,46
I want to redeem my reward cash,Usage of RewardCash,1844,46
online I can redeem point,Usage of RewardCash,2398,46
how to redeem points,Usage of RewardCash,2381,46
how do I redeem my rewardcash online,Usage of RewardCash,445,46
i want to redeem reward points,Usage of RewardCash,2178,46
how do I redeem using rewardcash online,Usage of RewardCash,2069,46
I want to redeem reward cash from my credit card,Usage of RewardCash,281,46
where on my online can I redeem my rewardcash,Usage of RewardCash,1985,46
I know where to process use my reward cash redeem,Usage of RewardCash,289,46
how can I redeem reward point via computer not mobile,Usage of RewardCash,3306,46
how can i redeem my reward in e bank,Usage of RewardCash,1464,46
redeem credit card reward,Usage of RewardCash,1246,46
redeem my reward dollar in credit card,Usage of RewardCash,769,46
how to redeem credit reward cash?,Usage of RewardCash,952,46
how to redeem credit points from my card,Usage of RewardCash,3071,46
where i can find place to redeem my rewardcash dollar in website,Usage of RewardCash,2364,46
I want to redeem my credit card reward cash,Usage of RewardCash,39,46
I want to redeem reward cash,Usage of RewardCash,585,46
how can I redeem my hsbc rewardcash,Usage of RewardCash,2268,46
know how i can redeem my points from my 2 credit cards via internet banking,Usage of RewardCash,2910,46
"if i have spent a lot on my credit card, how can i redeem reward",Usage of RewardCash,2328,46
how do I redeem credit card award from banking,Usage of RewardCash,950,46
check how i can spend my rewardcash,Usage of RewardCash,944,46
how can I redeem rewardcash via online,Usage of RewardCash,1620,46
i need you help to redeem my award points,Usage of RewardCash,86,46
how can i redeem my credit card reward,Usage of RewardCash,630,46
I want to check how to redeem my reward cash,Usage of RewardCash,1075,46
how can i redeem my card points,Usage of RewardCash,968,46
how can I redeem my reward cash Thursday website,Usage of RewardCash,170,46
i like to redeem my rewardcash. can u help me please,Usage of RewardCash,1219,46
redeem my premier rewardcash,Usage of RewardCash,381,46
rewardcash redeem,Usage of RewardCash,3239,46
how to redeem my credit card reward point?,Usage of RewardCash,2992,46
I want to redeem my credit card bonus point online. Please advice how can I do that?,Usage of RewardCash,2342,46
how can i redeem my credit card rewardcash via online,Usage of RewardCash,15,46
how do I redeem my credit card rewardcash,Usage of RewardCash,2766,46
how can i redeem balance,Usage of RewardCash,2366,46
can i redeem rewardcash at fortress,Usage of RewardCash,1481,46
use rewardcash dollar,Usage of RewardCash,682,46
redeem rewardcash award,Usage of RewardCash,530,46
how to redeem reward cash online,Usage of RewardCash,1488,46
how do I redeem my master card reward point ?,Usage of RewardCash,650,46
I am trying to redeem my reward point off credit card?,Usage of RewardCash,168,46
can i redeem rewardcash via online? not to download hsbc app,Usage of RewardCash,3080,46
I want to redeem my reward cash online,Usage of RewardCash,1516,46
how to redeem my rewardcash of my credit card,Usage of RewardCash,2885,46
redeem my reward cash,Usage of RewardCash,2673,46
how can i redeem my rewardcash,Usage of RewardCash,124,46
"rewardcash soon expire. Want to redeem on computer, not mobile app",Usage of RewardCash,3103,46
I want to redeem my credit reward cash please tell me where to do it?,Usage of RewardCash,2177,46
how do I redeem rewardcash online?,Usage of RewardCash,2462,46
how can I redeem my rewardcash of my credit card,Usage of RewardCash,2672,46
redeem credit card rewards,Usage of RewardCash,3120,46
I try to redeem reward cash through hsbc mobile application,Usage of RewardCash,3230,46
how do i redeem my rewardcash points,Usage of RewardCash,1558,46
which menu to get reward cash redeem?,Usage of RewardCash,163,46
how to redeem credit card reward from internet banking,Usage of RewardCash,883,46
how do I redeem my rewardcash dollar online as I have 1000 rewardcash dollar to expire in june,Usage of RewardCash,2622,46
how can I redeem rewardcash online,Usage of RewardCash,271,46
where can I redeem reward cash?,Usage of RewardCash,539,46
redeem my cash point,Usage of RewardCash,2405,46
I have a point I want to redeem,Usage of RewardCash,1369,46
check how to redeem my expired rewardcash,Usage of RewardCash,2573,46
how to redeem credit card bonus points,Usage of RewardCash,922,46
redeem my visa reward point but fail to do many many times,Usage of RewardCash,1485,46
link that i am missing to view to shop for reward,Usage of RewardCash,1592,46
I login my account now what to redeem my reward cash online,Usage of RewardCash,988,46
can I redeem my point online?,Usage of RewardCash,153,46
where can I redeem reward cash point,Usage of RewardCash,3259,46
how can I redeem my rewardcash on line,Usage of RewardCash,2993,46
I cannot find the button on webpage to redeem reward cash,Usage of RewardCash,1144,46
i am on hsbc website. want to redeem my points in credit card,Usage of RewardCash,417,46
I want to change my reward cash. I don't see how to do it through hsbc website,Usage of RewardCash,2269,46
where do I get redeem point?,Usage of RewardCash,986,46
tell me how to redeem reward cash?,Usage of RewardCash,3128,46
how can i redeem credit card cash award online,Usage of RewardCash,1403,46
redeem reward cash can I do online,Usage of RewardCash,3398,46
how to redeem my credit card reward point online,Usage of RewardCash,1695,46
how do I exactly use reward cash as I have not tried that before,Usage of RewardCash,349,46
cannot download reward+. Any other way to redeem rewardcash?,Usage of RewardCash,2765,46
i redeem rewardcash without downloading app,Usage of RewardCash,2280,46
how to redeem my points,Usage of RewardCash,2747,46
how to redeem my reward due in July,Usage of RewardCash,1591,46
I have reward cash due to expire soon. How do I find information to use up?,Usage of RewardCash,625,46
use rewardcash on my computer internet banking,Usage of RewardCash,2873,46
I want to redeem reward cash earn through my credit card how do I continue?,Usage of RewardCash,1854,46
check how to use rewardcash,Usage of RewardCash,9,46
I want to redeem my reward cash. May I know what is link to get that website?,Usage of RewardCash,344,46
how do I redeem point,Usage of RewardCash,3148,46
check how i can use my rewardcash,Usage of RewardCash,2694,46
redeem my rewardcash balance,Usage of RewardCash,2922,46
i redeem my rewardcash online,Usage of RewardCash,1906,46
ask how to redeem my rewards in my hsbc visacard,Usage of RewardCash,187,46
How can I use a rewards point to redeem,Usage of RewardCash,161,46
i am trying to redeem rewardcash online,Usage of RewardCash,1254,46
redeem 5 items from 2 sections from my reward point,Usage of RewardCash,1838,46
I am trying to redeem some of my visa reward cash point but cannot see how to do it online?,Usage of RewardCash,3118,46
can i redeem rewardcash online,Usage of RewardCash,2719,46
can I to redeem by rewardcash in total?,Usage of RewardCash,917,46
redeem my rewardcash,Usage of RewardCash,1749,46
how do I redeem my reward cash,Usage of RewardCash,1110,46
redeem my expire rewardcash,Usage of RewardCash,975,46
check how can I redeem reward cash of visa card,Usage of RewardCash,1720,46
do i must download rewardcash app to use rewardcash,Usage of RewardCash,762,46
i was trying to redeem my credit card reward point,Usage of RewardCash,2167,46
i have login to internet banking. How to redeem credit card reward,Usage of RewardCash,3332,46
redeem for rewardcash. please let me know how to apply,Usage of RewardCash,527,46
can I see reward list just don't know way to redeem,Usage of RewardCash,2916,46
how to redeem card reward point?,Usage of RewardCash,2572,46
how to redeem point by pib,Usage of RewardCash,2110,46
how do I redeem reward cash online,Usage of RewardCash,2849,46
how can I redeem my rewardcash if I dont download reward+ app,Usage of RewardCash,613,46
I cant even find website to redeem reward,Usage of RewardCash,860,46
how to redeem reward cash of credit card?,Usage of RewardCash,147,46
i have rewardcash expire in july. how to redeem without using app,Usage of RewardCash,1980,46
i am going to redeem rewardcash,Usage of RewardCash,1326,46
how do i redeem my rewardcash,Usage of RewardCash,2487,46
reward cash how do I redeem,Usage of RewardCash,1737,46
how do I redeem reward cash?,Usage of RewardCash,775,46
how to redeem my credit card reward cash?,Usage of RewardCash,2683,46
I want to redeem reward cash but I don't know where and how,Usage of RewardCash,439,46
can I redeem my reward cash online?,Usage of RewardCash,1857,46
i have 2000 point expire in august. what can i redeem,Usage of RewardCash,1703,46
how do I navigate to the link where I can redeem rewardcash online,Usage of RewardCash,457,46
how to redeem my rewardcash online,Usage of RewardCash,437,46
how can I redeem rewardcash with credit card,Usage of RewardCash,3003,46
how do I redeem point in my credit card?,Usage of RewardCash,1068,46
redeem for rewardcash but i don't have internet banking,Usage of RewardCash,269,46
how can I redeem reward money earn via my credit card.,Usage of RewardCash,63,46
i get receive 20 rewardcash dollar i can only redeem via designated merchant,Usage of RewardCash,1593,46
how can I redeem points online,Usage of RewardCash,1853,46
How can I redeem cash point from my credit card by pib?,Usage of RewardCash,3016,46
how can i redeem my cash point online,Usage of RewardCash,1163,46
hsbc kindly help how may i redeem my credit card rewards point online,Usage of RewardCash,1714,46
I am trying to redeem my reward cash but not sure if I understand the malfunction correctly,Usage of RewardCash,1653,46
can i just redeem with 200 rewardcash,Usage of RewardCash,468,46
how can I redeem my reward cash by pib?,Usage of RewardCash,79,46
cannot find how to redeem rewardcash,Usage of RewardCash,2440,46
know how to redeem rewardcash without going through app,Usage of RewardCash,2344,46
please advise how to redeem my rewardcash,Usage of RewardCash,2838,46
redeem my card points,Usage of RewardCash,2964,46
how to redeem point online,Usage of RewardCash,1972,46
I try to redeem my reward point in hsbc gmail match app through online,Usage of RewardCash,2514,46
redeem reward cash in computer,Usage of RewardCash,545,46
wanna see where i can do redeem credit card reward points online,Usage of RewardCash,301,46
how to redeem reward,Usage of RewardCash,1093,46
please advice how I redeem my reward cash at pib,Usage of RewardCash,2113,46
way to redeem points on computer,Usage of RewardCash,1797,46
I have login but not seem to find where can I go to choose what to redeem point,Usage of RewardCash,2260,46
my rewardcash will expire on may please advise how can I redeem it,Usage of RewardCash,3334,46
am trying to redeem points of credit card but unable to do it,Usage of RewardCash,1009,46
redeem my reward,Usage of RewardCash,1024,46
i try to redeem rewardcash at online bank,Usage of RewardCash,2286,46
I have a reward cash point where do I get redemption?,Usage of RewardCash,3049,46
help to redeem rewardcash,Usage of RewardCash,640,46
I want to redeem some hot reward point as it will expire soon,Usage of RewardCash,3317,46
how do I redeem credit card reward,Usage of RewardCash,3184,46
how can i redeem rewardcash of credit card number end in 225,Usage of RewardCash,2323,46
please let me know how I can redeem card reward,Usage of RewardCash,2840,46
reward point redeem,Usage of RewardCash,1261,46
how to use redeem credit card reward cash balance on website,Usage of RewardCash,1232,46
I want to ask how to redeem my recent rewardcash,Usage of RewardCash,766,46
how to redeem reward cash in hsbc website?,Usage of RewardCash,2918,46
how do I use that reward cash ?,Usage of RewardCash,473,46
please redeem reward cash for me,Usage of RewardCash,1432,46
I cannot find where to redeem reward cash,Usage of RewardCash,2005,46
please help me. How to redeem rewardcash through internet banking,Usage of RewardCash,2267,46
question on how to use credit card rewardcash,Usage of RewardCash,3363,46
redeem my reward points last year,Usage of RewardCash,2930,46
how to redeem point to expire,Usage of RewardCash,1867,46
how can I redeem my credit card reward cash by pib,Usage of RewardCash,1150,46
I want to redeem reward point,Usage of RewardCash,1659,46
I want to redeem my a reward cash point that expires tomorrow 12pm,Usage of RewardCash,3081,46
please tell me how to redeem my rewardcash on internet banking,Usage of RewardCash,1099,46
And how to utilized Reward Cash,Usage of RewardCash,10,46
check how to use my rewardcash,Usage of RewardCash,2123,46
I want to redeem my reward cash but I don't know how,Usage of RewardCash,1948,46
wonder how to redeem my rewardcash point in my credit card,Usage of RewardCash,2532,46
I want to know how to redeem my reward cash,Usage of RewardCash,355,46
redeem my rewardcash point,Usage of RewardCash,206,46
I want to redempt my reward cash balance.,Usage of RewardCash,1976,46
quick question. how do i redeem rewards,Usage of RewardCash,1647,46
redeem rewards dollar,Usage of RewardCash,478,46
I am trying to redeem reward cash on my card,Usage of RewardCash,33,46
where can I redeem my rewards,Usage of RewardCash,2482,46
how to redeem my points in hsbc reward website,Usage of RewardCash,3308,46
i have rewardcash going to expire in this year. check how to redeem it,Usage of RewardCash,1323,46
redeem rewards,Usage of RewardCash,2225,46
how can I redeem visa reward point please?,Usage of RewardCash,321,46
how to redeem my point,Usage of RewardCash,2712,46
my hsbc points can redeem online,Usage of RewardCash,531,46
I know where is able to redeem reward cash from pib website,Usage of RewardCash,2810,46
please show me how to redeem my credit points from hsbc website,Usage of RewardCash,3218,46
i just want to use rewards points to redeem,Usage of RewardCash,1038,46
reward cash is actual money I have to use it,Usage of RewardCash,310,46
how to redeem bonus point?,Usage of RewardCash,126,46
when will hsbc redeem case reward,Usage of RewardCash,1184,46
how do I redeem rewardcash dollar,Usage of RewardCash,1633,46
i am trying to redeem my rewardcash but I live in australia now. cannot download app,Usage of RewardCash,743,46
I want to redeem my credit card reward points can hsbc please advise how to redeem,Usage of RewardCash,2472,46
I am checking the online reward redemption,Usage of RewardCash,87,46
how to redeem my bonus point online,Usage of RewardCash,1003,46
what steps should I take to redeem my card reward point online,Usage of RewardCash,1663,46
how can I have my credit card reward cash redeem,Usage of RewardCash,1649,46
I want to redeem my rewarad dolloar but cannot find the function,Usage of RewardCash,2997,46
i am concerned about process of redeem 300 reward dollar,Usage of RewardCash,1284,46
how to redeem reward in computer not phone?,Usage of RewardCash,851,46
redeem rewardcash point,Usage of RewardCash,1738,46
i am trying to redeem with rewardcash,Usage of RewardCash,2755,46
how do i collect my rewardcash points from credit card,Usage of RewardCash,2812,46
how can I get my credit card reward cash redeem online,Usage of RewardCash,647,46
how do i redeem my credit card rewardcash thank,Usage of RewardCash,2911,46
can i just redeem with all rewardcash without paying money,Usage of RewardCash,2756,46
how can I redeem my rewardcash,Usage of RewardCash,3331,46
how to redeem reward in computer,Usage of RewardCash,329,46
how can I redeem my rewardcash today,Usage of RewardCash,802,46
rewardcash redemption,Usage of RewardCash,1921,46
can i redeem it from hsbc website directly instead of from hsbc rewards+,Usage of RewardCash,814,46
i get a text to say i need to redeem my rewardcash. how do i do,Usage of RewardCash,26,46
how i can do to redeem rewards,Usage of RewardCash,1422,46
how do i redeem rewardcash,Usage of RewardCash,2490,46
how to process rewards redemption,Usage of RewardCash,2561,46
I want to redeem my reward cash but I am not able to do it,Usage of RewardCash,528,46
redeem my rewardcash through internet banking,Usage of RewardCash,597,46
redeem rewardcash via online,Usage of RewardCash,353,46
I want to redeem my credit card reward cash. May I know where can I access online?,Usage of RewardCash,2111,46
how do I redeem my rewardcash,Usage of RewardCash,1357,46
how do I redeem point that I have accumulate on my signature card,Usage of RewardCash,1010,46
I want to redeem reward cash by my computer,Usage of RewardCash,141,46
how can I redeem rewardcash in online,Usage of RewardCash,600,46
how to use reward cash?,Usage of RewardCash,2142,46
redeem reward points. can i do it here online,Usage of RewardCash,1821,46
how do I redeem my point on my credit card?,Usage of RewardCash,2786,46
i just login reward + want to buy welcome coupon with my cash dollar,Redeem vouchers / gifts via Reward+ RewardCash e-Shop,3116,29
i am on reward+ webpage. don't know how to redeem cash coupon. How to login shop?,Redeem vouchers / gifts via Reward+ RewardCash e-Shop,1380,29
redeem maxim mooncake via rewards app but don't know how to,Redeem vouchers / gifts via Reward+ RewardCash e-Shop,1923,29
redeem cash coupon. can i do it in reward+,Redeem vouchers / gifts via Reward+ RewardCash e-Shop,2548,29
how can i redeem coupon using reward+,Redeem vouchers / gifts via Reward+ RewardCash e-Shop,2349,29
please let me know how to redeem jade account easter cake with rewards app,Redeem vouchers / gifts via Reward+ RewardCash e-Shop,1234,29
join rewardcash certificate,Register for RewardCash Certificate Scheme,2515,26
apply rewardcash certificate,Register for RewardCash Certificate Scheme,236,26
but what i want is to convert it to rewardcash certificate. i will never lose it,Register for RewardCash Certificate Scheme,971,26
how can i change rewardcash to rewardcash certificate,Register for RewardCash Certificate Scheme,2940,26
what are hot reward of options available,Spending categories for 'Rewards of Your Choice',2175,3
hot rewards of hsbc choose spending category,Spending categories for 'Rewards of Your Choice',1147,3
where can i find detail of 5 spending category for hot rewards of hsbc choice,Spending categories for 'Rewards of Your Choice',1463,3
ok what is hsbc card hotline to check the expiring points deadline for use of voucher,Check the expiry dates of RewardCash,2800,54
Just trying to figure out where can i check expired date of my reward points,Check the expiry dates of RewardCash,3015,54
i wanna know is there any expired date for rewardcash,Check the expiry dates of RewardCash,3126,54
"In the past, we can use global transfer to transfer my CNY in HK to my CNY in CN account.",Which currencies does Global Transfers support,2557,1
just want to ask can I use global transfer to my china rmb account,Which currencies does Global Transfers support,1389,1
I want to use Global Transfer to send CNY from HK to Shenzhen,Which currencies does Global Transfers support,256,1
can I transfer my own rmb money to my own hsbc account in china,Which currencies does Global Transfers support,1588,1
what other currency cannot do global transfer,Which currencies does Global Transfers support,1027,1
how can I global transfer RMB5000 from HK HSBC account to china HSBC account,Which currencies does Global Transfers support,351,1
Can I transfer RMB using global transfer service?,Which currencies does Global Transfers support,29,1
double check w your manager whether global transfer can allow to do EUR currency?,Which currencies does Global Transfers support,658,1
what is the maximum for daily global transfer in GBP from my HK Jade account to my HSBC UK account,What is the transfer limit for Global Transfers to my own selected HSBC accounts,2757,45
what is daily global limit of gbp transfer to my own hsbc uk account,What is the transfer limit for Global Transfers to my own selected HSBC accounts,2026,45
"i want to use global transfer to my self-named account, what is the daily maximum amount?",What is the transfer limit for Global Transfers to my own selected HSBC accounts,2555,45
but got message that hsbc has exceeded hsbc max daily transfer limit for global transfer,What is the transfer limit for Global Transfers,2195,16
what is usd global transfer limit,What is the transfer limit for Global Transfers,1005,16
just to view for global transfer what is the limit?,What is the transfer limit for Global Transfers,1567,16
how do i find out my maximum daily transfer limit for global transfers?,What is the transfer limit for Global Transfers,2633,16
what is the limit total for my global transfer in hsbc,What is the transfer limit for Global Transfers,797,16
hsbc have exceeded hsbc max daily transfer limit for global transfer,What is the transfer limit for Global Transfers,2967,16
can you please tell me what my daily global transfer limit is?,What is the transfer limit for Global Transfers,3037,16
what is limit total for my global transfer in hsbc,What is the transfer limit for Global Transfers,2871,16
what is the max daily transfer limit for global transfer to my own account in usd,What is the transfer limit for Global Transfers,2853,16
What is the daily limit for global transfer?,What is the transfer limit for Global Transfers,1213,16
can i know the limit for global transfer ?,What is the transfer limit for Global Transfers,211,16
